{"camera":{"distance":"WIDE","focalTarget":"Velkaryn","height":"LOW","lensMm":35,"pitchDegrees":-4.0,"projection":"PERSPECTIVE","rollDegrees":0.0,"yawDegrees":0.0},"colorPolicy":{"accentPalette":[],"basePalette":[],"energyPalette":[],"neonLimit":0.0,"saturationPolicy":"artSpec-colorPolicy-saturationPolicy"},"composition":{"balance":"controlled monumental balance","depthPriority":"subject-first with monumental depth","dominance":"grounded-central-dominance","environmentRatio":0.38,"leadingGeometry":["basalt-megalith","weathered-apex-predator"],"ruleOfThirds":false,"symmetry":"NEAR_SYMMETRIC"},"detail":{"macro":{"constraints":[],"priority":1,"targets":["anatomy","silhouette","weight","pose","environment-scale"]},"meso":{"constraints":[],"priority":1,"targets":["scale-plates","wing-structure","horn-structure","stone-architecture","primitive-mechanics"]},"micro":{"constraints":[],"priority":1,"targets":["erosion","fractures","mineral-deposits","surface-wear","subsurface-glow"]}},"dragon":{"archetype":"ancient-dragon","armor":{"form":"natural-plate-dominant"},"body":{"form":"weathered-apex-predator"},"bodyStructure":{"form":"ancient-heavy"},"eyes":{"form":"resonance-influenced ember eyes"},"head":{"form":"stone-hewn-cranial-mass"},"horns":{"form":"primitive-crown-horns"},"markings":{"form":"controlled resonance-influenced structural markings"},"mechanicalAugmentation":{"form":"ritual-mechanical-graft"},"scales":{"form":"obsidian"},"tail":{"form":"anatomically balanced counterweight tail"},"wings":{"form":"scarred-structural"}},"environment":{"architecture":{"form":"basalt-megalith"},"atmosphere":"ancient-storm-pressure","biome":"Primitive Origin monumental biome","depthLayers":{"background":["ancient-storm-pressure"],"foreground":["obsidian terrain mass"],"midground":["basalt-megalith"]},"terrain":"obsidian megalithic terrain","weather":"controlled atmospheric weathering"},"framing":{"aspectRatio":"1:1","cropPolicy":"FULL_BODY_REQUIRED","safeMargin":0.08,"subjectOccupancy":0.72},"identity":{"canonicalName":"Velkaryn","dna":{"archetype":"ancient-dragon","body":{"mass":"heavy","posture":"grounded"},"horns":{"geometry":"forward-crown"},"lineage":{"cohort":"RARE","collection":"Founding-6000","generation":1,"index":6},"markings":{"language":"fractured-runes"},"wings":{"structure":"broad-ribbed"}},"dnaHash":"sha256:4bfe3523d419fe4fe686e6e9638b6c80ccb7d0462fd0b096a86381c1f1e1ce9c","era":"Primitive Origin","generationTheme":"Primitive Origin","serial":"#0006","tier":"RARE","tokenId":6},"lighting":{"contrast":0.82,"exposureBias":-0.25,"fill":"restrained environmental fill","key":"volumetric-ash-light","rim":"dormant-energy-vein","volumetrics":"ancient-storm-pressure"},"materials":{"assignments":{"dragonPrimary":"obsidian","dragonSecondary":"oxidized-steel","energyAccent":"dormant-energy-vein","environmentPrimary":"obsidian"},"libraryRefs":["obsidian","oxidized-steel","dormant-energy-vein"],"weatheringPolicy":"physically coherent controlled weathering"},"negativeConstraints":{"allowCartoonStyling":false,"allowDetailToMaskBadAnatomy":false,"allowFranchiseImitation":false,"allowUncontrolledText":false,"allowWatermark":false,"forbiddenElements":[]},"pose":{"contactPoints":["hind limbs grounded","forelimb contact controlled"],"headDirection":"toward primary focal axis","motionState":"controlled latent motion","stance":"grounded monumental apex stance","tailFlow":"counterbalancing structural arc","wingState":"scarred-structural"},"qualityRequirements":{"canonicalApprovalMode":"MANUAL_REQUIRED","maximumArtifactScore":0.0,"minimumScores":{"anatomy":0.9,"composition":0.82,"detail":0.8,"identityConsistency":0.95,"material":0.8,"silhouette":0.85,"traitCompliance":0.95,"visualGrammar":0.9},"requireManualApproval":true},"renderIntent":{"cinematicWeight":0.0,"detailDensity":0.82,"preserveIdentity":true,"realism":0.0,"styleIntent":"artSpec-renderIntent-styleIntent","targetAspectRatio":"artSpec-renderIntent-targetAspectRatio","targetResolution":{"height":64,"width":64}},"resonance":{"accentGeometry":"weathered-apex-predator","atmosphericBehavior":"ancient-storm-pressure","energyTopology":"identity-preserving controlled topology","glyphInfluence":"subtle structural motif influence","lightingRhythm":"volumetric-ash-light","narrativeOnly":true,"spectrum":[],"strength":0.0},"seed":11691515375195877206,"specVersion":"OX-ART-SPEC-1"}