{"camera":{"distance":"WIDE","focalTarget":"Nytherion Basalt Crown","height":"LOW","lensMm":50,"pitchDegrees":-4.0,"projection":"PERSPECTIVE","rollDegrees":0.0,"yawDegrees":0.0},"colorPolicy":{"accentPalette":["storm-blue","obsidian"],"basePalette":["obsidian-black","basalt-grey","weathered-stone"],"energyPalette":["storm-blue"],"neonLimit":0.08,"saturationPolicy":"restrained mineral accents only"},"composition":{"balance":"controlled monumental balance","depthPriority":"subject-first with monumental depth","dominance":"architectonic-central-dominance","environmentRatio":0.38,"leadingGeometry":["ascended-machine-megalith","ancient-precision-predator"],"ruleOfThirds":false,"symmetry":"NEAR_SYMMETRIC"},"detail":{"macro":{"constraints":[],"priority":1,"targets":["anatomy","silhouette","architectonic-form","pose","world-scale-coherence"]},"meso":{"constraints":[],"priority":1,"targets":["precision-armor","wing-engineering","integrated-systems","architectonic-environment","energy-topology"]},"micro":{"constraints":[],"priority":1,"targets":["precision-weathering","controlled-microfracture","material-interface","mineral-growth","subsurface-energy-detail"]}},"dragon":{"archetype":"primordial-colossal-dragon","armor":{"form":"architectonic-dark-alloy"},"body":{"form":"fortress-backed"},"bodyStructure":{"form":"apex-architectonic"},"eyes":{"form":"resonance-influenced {\"energyTopology\":\"tempest-glyph-topology\",\"intensity\":0.583,\"narrativeRole\":\"deterministic visual influence only\",\"spectrum\":[\"storm-blue\",\"obsidian\",\"restrained-crimson\"]} eyes"},"head":{"form":"ascended-relic-geometry"},"horns":{"form":"layered-obsidian-buttresses"},"markings":{"form":"controlled resonance-influenced structural markings"},"mechanicalAugmentation":{"form":"ancient-proto-technology"},"scales":{"form":"basalt"},"tail":{"form":"anatomically balanced counterweight tail"},"wings":{"form":"broad-basalt-fan"}},"environment":{"architecture":{"form":"gothic-megalithic-cyclopean-storm-sanctum"},"atmosphere":"dark monumental primordial pressure","biome":"cyclopean-storm-sanctum","depthLayers":{"background":["structured-energy-atmosphere"],"foreground":["basalt terrain mass"],"midground":["ascended-machine-megalith"]},"terrain":"basalt megalithic terrain","weather":"mineral fog, ash and controlled primordial storm"},"framing":{"aspectRatio":"1:1","cropPolicy":"FULL_BODY_REQUIRED","safeMargin":0.08,"subjectOccupancy":0.72},"identity":{"canonicalName":"Nytherion Basalt Crown","dna":{"archetype":"primordial-colossal-dragon","augmentation":"ancient-proto-technology","bodyStructure":"fortress-backed","dnaVersion":"OX-GENESIS-DNA-1","environment":"cyclopean-storm-sanctum","hornArchitecture":"layered-obsidian-buttresses","lightingProfile":"cold-storm-toplight","lineage":{"cohort":"GENESIS","era":"PRIMORDIAL ORIGIN","index":4,"maximumSupply":1000,"tier":"LEGENDARY"},"poseProfile":"ascending-megalithic-profile","primaryMaterial":"basalt","secondaryMaterial":"weathered-stone","wingGeometry":"broad-basalt-fan"},"dnaHash":"sha256:f6364cf2316318483f2c8eaee4007029b9393c13e5fffbbae12d9b5e4e487def","era":"Ascended Origin","generationTheme":"Genesis / Primordial Origin","serial":"#0004","tier":"LEGENDARY","tokenId":4},"lighting":{"contrast":0.9,"exposureBias":-0.35,"fill":"restrained environmental fill","key":"cold-storm-toplight","rim":"storm-blue","volumetrics":"structured-energy-atmosphere"},"materials":{"assignments":{"dragonPrimary":"basalt","dragonSecondary":"weathered-stone","energyAccent":"storm-blue","environmentPrimary":"weathered-basalt"},"libraryRefs":["basalt","dark-forged-metal","mineralized-alloy","obsidian","structured-energy-surface","weathered-stone"],"weatheringPolicy":"extreme physically coherent erosion, fractures, ash deposits and mineral variation"},"negativeConstraints":{"allowCartoonStyling":false,"allowDetailToMaskBadAnatomy":false,"allowFranchiseImitation":false,"allowUncontrolledText":false,"allowWatermark":false,"forbiddenElements":["broken wings","cartoon","duplicate limbs","excessive neon","franchise-derived design","generic fantasy dragon","malformed anatomy","random text","uncontrolled cyberpunk","watermark"]},"pose":{"contactPoints":["hind limbs grounded","forelimb contact controlled"],"headDirection":"toward primary focal axis","motionState":"controlled latent motion","stance":"ascending-megalithic-profile","tailFlow":"counterbalancing structural arc","wingState":"integrated-ancient-flight-structure"},"qualityRequirements":{"canonicalApprovalMode":"MANUAL_REQUIRED","maximumArtifactScore":0.0,"minimumScores":{"anatomy":0.9,"composition":0.82,"detail":0.8,"identityConsistency":0.95,"material":0.8,"silhouette":0.85,"traitCompliance":0.95,"visualGrammar":0.9},"requireManualApproval":true},"renderIntent":{"cinematicWeight":0.95,"detailDensity":0.9,"preserveIdentity":true,"realism":0.92,"styleIntent":"monumental dark primordial dragon realism","targetAspectRatio":"1:1","targetResolution":{"height":512,"width":512}},"resonance":{"accentGeometry":"layered-obsidian-buttresses","atmosphericBehavior":"mineral fog shaped by deterministic glyph geometry","energyTopology":"tempest-deterministic-topology","glyphInfluence":"5-spoke rhythm; 5-ring structural cadence","lightingRhythm":"cold-storm-toplight","narrativeOnly":true,"spectrum":["storm-blue","obsidian","restrained-crimson"],"strength":0.583},"seed":619885554085082306,"specVersion":"OX-ART-SPEC-1"}