{"camera":{"distance":"WIDE","focalTarget":"Kaeloryx","height":"LOW","lensMm":28,"pitchDegrees":-4.0,"projection":"PERSPECTIVE","rollDegrees":0.0,"yawDegrees":0.0},"colorPolicy":{"accentPalette":[],"basePalette":[],"energyPalette":[],"neonLimit":0.0,"saturationPolicy":"artSpec-colorPolicy-saturationPolicy"},"composition":{"balance":"controlled monumental balance","depthPriority":"subject-first with monumental depth","dominance":"environmental-scale-contrast","environmentRatio":0.38,"leadingGeometry":["buried-monumental-ruin","low-centered-power"],"ruleOfThirds":false,"symmetry":"NEAR_SYMMETRIC"},"detail":{"macro":{"constraints":[],"priority":1,"targets":["anatomy","silhouette","weight","pose","environment-scale"]},"meso":{"constraints":[],"priority":1,"targets":["scale-plates","wing-structure","horn-structure","stone-architecture","primitive-mechanics"]},"micro":{"constraints":[],"priority":1,"targets":["erosion","fractures","mineral-deposits","surface-wear","subsurface-glow"]}},"dragon":{"archetype":"basalt-wyrm","armor":{"form":"primitive-forged-segments"},"body":{"form":"low-centered-power"},"bodyStructure":{"form":"ancient-heavy"},"eyes":{"form":"resonance-influenced mineral-red eyes"},"head":{"form":"ancient-predatory-wedge"},"horns":{"form":"mineral-crusted-horns"},"markings":{"form":"controlled resonance-influenced structural markings"},"mechanicalAugmentation":{"form":"ritual-mechanical-graft"},"scales":{"form":"weathered-dark-stone"},"tail":{"form":"anatomically balanced counterweight tail"},"wings":{"form":"scarred-structural"}},"environment":{"architecture":{"form":"buried-monumental-ruin"},"atmosphere":"volcanic-haze","biome":"Primitive Origin monumental biome","depthLayers":{"background":["volcanic-haze"],"foreground":["weathered-dark-stone terrain mass"],"midground":["buried-monumental-ruin"]},"terrain":"weathered-dark-stone megalithic terrain","weather":"controlled atmospheric weathering"},"framing":{"aspectRatio":"1:1","cropPolicy":"FULL_BODY_REQUIRED","safeMargin":0.08,"subjectOccupancy":0.72},"identity":{"canonicalName":"Kaeloryx","dna":{"archetype":"basalt-wyrm","body":{"mass":"massive","posture":"watchful"},"horns":{"geometry":"swept-crown"},"lineage":{"cohort":"RARE","collection":"Founding-6000","generation":1,"index":2},"markings":{"language":"mineral-lines"},"wings":{"structure":"heavy-membranous"}},"dnaHash":"sha256:cfcd8e3a443c2e64d5f35f58b7ea0c98df96f71955651824fe716753e70719ce","era":"Primitive Origin","generationTheme":"Primitive Origin","serial":"#0002","tier":"RARE","tokenId":2},"lighting":{"contrast":0.82,"exposureBias":-0.25,"fill":"restrained environmental fill","key":"volumetric-ash-light","rim":"subsurface-amber","volumetrics":"volcanic-haze"},"materials":{"assignments":{"dragonPrimary":"weathered-dark-stone","dragonSecondary":"mineral-deposit","energyAccent":"subsurface-amber","environmentPrimary":"weathered-dark-stone"},"libraryRefs":["weathered-dark-stone","mineral-deposit","subsurface-amber"],"weatheringPolicy":"physically coherent controlled weathering"},"negativeConstraints":{"allowCartoonStyling":false,"allowDetailToMaskBadAnatomy":false,"allowFranchiseImitation":false,"allowUncontrolledText":false,"allowWatermark":false,"forbiddenElements":[]},"pose":{"contactPoints":["hind limbs grounded","forelimb contact controlled"],"headDirection":"toward primary focal axis","motionState":"controlled latent motion","stance":"grounded monumental apex stance","tailFlow":"counterbalancing structural arc","wingState":"scarred-structural"},"qualityRequirements":{"canonicalApprovalMode":"MANUAL_REQUIRED","maximumArtifactScore":0.0,"minimumScores":{"anatomy":0.9,"composition":0.82,"detail":0.8,"identityConsistency":0.95,"material":0.8,"silhouette":0.85,"traitCompliance":0.95,"visualGrammar":0.9},"requireManualApproval":true},"renderIntent":{"cinematicWeight":0.0,"detailDensity":0.82,"preserveIdentity":true,"realism":0.0,"styleIntent":"artSpec-renderIntent-styleIntent","targetAspectRatio":"artSpec-renderIntent-targetAspectRatio","targetResolution":{"height":64,"width":64}},"resonance":{"accentGeometry":"low-centered-power","atmosphericBehavior":"volcanic-haze","energyTopology":"identity-preserving controlled topology","glyphInfluence":"subtle structural motif influence","lightingRhythm":"volumetric-ash-light","narrativeOnly":true,"spectrum":[],"strength":0.0},"seed":5477222264661703837,"specVersion":"OX-ART-SPEC-1"}