{"camera":{"distance":"WIDE","focalTarget":"Korvaelis","height":"LOW","lensMm":35,"pitchDegrees":-4.0,"projection":"PERSPECTIVE","rollDegrees":0.0,"yawDegrees":0.0},"colorPolicy":{"accentPalette":[],"basePalette":[],"energyPalette":[],"neonLimit":0.0,"saturationPolicy":"artSpec-colorPolicy-saturationPolicy"},"composition":{"balance":"controlled monumental balance","depthPriority":"subject-first with monumental depth","dominance":"low-angle-monumentality","environmentRatio":0.38,"leadingGeometry":["buried-monumental-ruin","weathered-apex-predator"],"ruleOfThirds":false,"symmetry":"NEAR_SYMMETRIC"},"detail":{"macro":{"constraints":[],"priority":1,"targets":["anatomy","silhouette","weight","pose","environment-scale"]},"meso":{"constraints":[],"priority":1,"targets":["scale-plates","wing-structure","horn-structure","stone-architecture","primitive-mechanics"]},"micro":{"constraints":[],"priority":1,"targets":["erosion","fractures","mineral-deposits","surface-wear","subsurface-glow"]}},"dragon":{"archetype":"obsidian-guardian","armor":{"form":"primitive-forged-segments"},"body":{"form":"weathered-apex-predator"},"bodyStructure":{"form":"ancient-heavy"},"eyes":{"form":"resonance-influenced deep-cyan eyes"},"head":{"form":"heavy-basal-skull"},"horns":{"form":"eroded-basalt-horns"},"markings":{"form":"controlled resonance-influenced structural markings"},"mechanicalAugmentation":{"form":"dormant-relic-interface"},"scales":{"form":"basalt"},"tail":{"form":"anatomically balanced counterweight tail"},"wings":{"form":"massive-membranous"}},"environment":{"architecture":{"form":"buried-monumental-ruin"},"atmosphere":"mineral-dust","biome":"Primitive Origin monumental biome","depthLayers":{"background":["mineral-dust"],"foreground":["basalt terrain mass"],"midground":["buried-monumental-ruin"]},"terrain":"basalt megalithic terrain","weather":"controlled atmospheric weathering"},"framing":{"aspectRatio":"1:1","cropPolicy":"FULL_BODY_REQUIRED","safeMargin":0.08,"subjectOccupancy":0.72},"identity":{"canonicalName":"Korvaelis","dna":{"archetype":"obsidian-guardian","body":{"mass":"broad","posture":"ascending"},"horns":{"geometry":"split-crown"},"lineage":{"cohort":"RARE","collection":"Founding-6000","generation":1,"index":9},"markings":{"language":"ritual-scars"},"wings":{"structure":"long-ribbed"}},"dnaHash":"sha256:269259d98bdd54274100fbde55fe25cfd59961feb3998245e20f73537115814d","era":"Primitive Origin","generationTheme":"Primitive Origin","serial":"#0009","tier":"RARE","tokenId":9},"lighting":{"contrast":0.82,"exposureBias":-0.25,"fill":"restrained environmental fill","key":"volumetric-ash-light","rim":"dormant-energy-vein","volumetrics":"mineral-dust"},"materials":{"assignments":{"dragonPrimary":"basalt","dragonSecondary":"mineral-deposit","energyAccent":"dormant-energy-vein","environmentPrimary":"basalt"},"libraryRefs":["basalt","mineral-deposit","dormant-energy-vein"],"weatheringPolicy":"physically coherent controlled weathering"},"negativeConstraints":{"allowCartoonStyling":false,"allowDetailToMaskBadAnatomy":false,"allowFranchiseImitation":false,"allowUncontrolledText":false,"allowWatermark":false,"forbiddenElements":[]},"pose":{"contactPoints":["hind limbs grounded","forelimb contact controlled"],"headDirection":"toward primary focal axis","motionState":"controlled latent motion","stance":"grounded monumental apex stance","tailFlow":"counterbalancing structural arc","wingState":"massive-membranous"},"qualityRequirements":{"canonicalApprovalMode":"MANUAL_REQUIRED","maximumArtifactScore":0.0,"minimumScores":{"anatomy":0.9,"composition":0.82,"detail":0.8,"identityConsistency":0.95,"material":0.8,"silhouette":0.85,"traitCompliance":0.95,"visualGrammar":0.9},"requireManualApproval":true},"renderIntent":{"cinematicWeight":0.0,"detailDensity":0.82,"preserveIdentity":true,"realism":0.0,"styleIntent":"artSpec-renderIntent-styleIntent","targetAspectRatio":"artSpec-renderIntent-targetAspectRatio","targetResolution":{"height":64,"width":64}},"resonance":{"accentGeometry":"weathered-apex-predator","atmosphericBehavior":"mineral-dust","energyTopology":"identity-preserving controlled topology","glyphInfluence":"subtle structural motif influence","lightingRhythm":"volumetric-ash-light","narrativeOnly":true,"spectrum":[],"strength":0.0},"seed":16780871124537626323,"specVersion":"OX-ART-SPEC-1"}