{"camera":{"distance":"WIDE","focalTarget":"Aerzathen","height":"LOW","lensMm":50,"pitchDegrees":-4.0,"projection":"PERSPECTIVE","rollDegrees":0.0,"yawDegrees":0.0},"colorPolicy":{"accentPalette":[],"basePalette":[],"energyPalette":[],"neonLimit":0.0,"saturationPolicy":"artSpec-colorPolicy-saturationPolicy"},"composition":{"balance":"controlled monumental balance","depthPriority":"subject-first with monumental depth","dominance":"environmental-scale-contrast","environmentRatio":0.38,"leadingGeometry":["cyclopean-stone-complex","weathered-apex-predator"],"ruleOfThirds":false,"symmetry":"NEAR_SYMMETRIC"},"detail":{"macro":{"constraints":[],"priority":1,"targets":["anatomy","silhouette","weight","pose","environment-scale"]},"meso":{"constraints":[],"priority":1,"targets":["scale-plates","wing-structure","horn-structure","stone-architecture","primitive-mechanics"]},"micro":{"constraints":[],"priority":1,"targets":["erosion","fractures","mineral-deposits","surface-wear","subsurface-glow"]}},"dragon":{"archetype":"mineral-titan","armor":{"form":"natural-plate-dominant"},"body":{"form":"weathered-apex-predator"},"bodyStructure":{"form":"dense-predatory"},"eyes":{"form":"resonance-influenced white-ash eyes"},"head":{"form":"heavy-basal-skull"},"horns":{"form":"mineral-crusted-horns"},"markings":{"form":"controlled resonance-influenced structural markings"},"mechanicalAugmentation":{"form":"dormant-relic-interface"},"scales":{"form":"obsidian"},"tail":{"form":"anatomically balanced counterweight tail"},"wings":{"form":"massive-membranous"}},"environment":{"architecture":{"form":"cyclopean-stone-complex"},"atmosphere":"volcanic-haze","biome":"Primitive Origin monumental biome","depthLayers":{"background":["volcanic-haze"],"foreground":["obsidian terrain mass"],"midground":["cyclopean-stone-complex"]},"terrain":"obsidian megalithic terrain","weather":"controlled atmospheric weathering"},"framing":{"aspectRatio":"1:1","cropPolicy":"FULL_BODY_REQUIRED","safeMargin":0.08,"subjectOccupancy":0.72},"identity":{"canonicalName":"Aerzathen","dna":{"archetype":"mineral-titan","body":{"mass":"monumental","posture":"coiled"},"horns":{"geometry":"mineral-array"},"lineage":{"cohort":"RARE","collection":"Founding-6000","generation":1,"index":10},"markings":{"language":"subsurface-glyphs"},"wings":{"structure":"compact-power"}},"dnaHash":"sha256:0848c9d40d8d56b6408849c1bc328f80fd7dfa72fcfc08fb94530226907a3f5f","era":"Primitive Origin","generationTheme":"Primitive Origin","serial":"#0010","tier":"RARE","tokenId":10},"lighting":{"contrast":0.82,"exposureBias":-0.25,"fill":"restrained environmental fill","key":"low-raking-monumental","rim":"subsurface-amber","volumetrics":"volcanic-haze"},"materials":{"assignments":{"dragonPrimary":"obsidian","dragonSecondary":"oxidized-steel","energyAccent":"subsurface-amber","environmentPrimary":"obsidian"},"libraryRefs":["obsidian","oxidized-steel","subsurface-amber"],"weatheringPolicy":"physically coherent controlled weathering"},"negativeConstraints":{"allowCartoonStyling":false,"allowDetailToMaskBadAnatomy":false,"allowFranchiseImitation":false,"allowUncontrolledText":false,"allowWatermark":false,"forbiddenElements":[]},"pose":{"contactPoints":["hind limbs grounded","forelimb contact controlled"],"headDirection":"toward primary focal axis","motionState":"controlled latent motion","stance":"grounded monumental apex stance","tailFlow":"counterbalancing structural arc","wingState":"massive-membranous"},"qualityRequirements":{"canonicalApprovalMode":"MANUAL_REQUIRED","maximumArtifactScore":0.0,"minimumScores":{"anatomy":0.9,"composition":0.82,"detail":0.8,"identityConsistency":0.95,"material":0.8,"silhouette":0.85,"traitCompliance":0.95,"visualGrammar":0.9},"requireManualApproval":true},"renderIntent":{"cinematicWeight":0.0,"detailDensity":0.82,"preserveIdentity":true,"realism":0.0,"styleIntent":"artSpec-renderIntent-styleIntent","targetAspectRatio":"artSpec-renderIntent-targetAspectRatio","targetResolution":{"height":64,"width":64}},"resonance":{"accentGeometry":"weathered-apex-predator","atmosphericBehavior":"volcanic-haze","energyTopology":"identity-preserving controlled topology","glyphInfluence":"subtle structural motif influence","lightingRhythm":"low-raking-monumental","narrativeOnly":true,"spectrum":[],"strength":0.0},"seed":15262576483821124987,"specVersion":"OX-ART-SPEC-1"}