{"camera":{"distance":"WIDE","focalTarget":"Vyrnathos the Origin Seal","height":"LOW","lensMm":28,"pitchDegrees":-4.0,"projection":"PERSPECTIVE","rollDegrees":0.0,"yawDegrees":0.0},"colorPolicy":{"accentPalette":["mineral-cyan","weathered-stone"],"basePalette":["obsidian-black","basalt-grey","weathered-stone"],"energyPalette":["mineral-cyan"],"neonLimit":0.08,"saturationPolicy":"restrained mineral accents only"},"composition":{"balance":"controlled monumental balance","depthPriority":"subject-first with monumental depth","dominance":"monumental-layered-depth","environmentRatio":0.38,"leadingGeometry":["architectonic-basalt-citadel","monumental-transcendent"],"ruleOfThirds":false,"symmetry":"NEAR_SYMMETRIC"},"detail":{"macro":{"constraints":[],"priority":1,"targets":["anatomy","silhouette","architectonic-form","pose","world-scale-coherence"]},"meso":{"constraints":[],"priority":1,"targets":["precision-armor","wing-engineering","integrated-systems","architectonic-environment","energy-topology"]},"micro":{"constraints":[],"priority":1,"targets":["precision-weathering","controlled-microfracture","material-interface","mineral-growth","subsurface-energy-detail"]}},"dragon":{"archetype":"primordial-colossal-dragon","armor":{"form":"architectonic-dark-alloy"},"body":{"form":"ancient-predatory"},"bodyStructure":{"form":"apex-architectonic"},"eyes":{"form":"resonance-influenced {\"energyTopology\":\"chthonic-glyph-topology\",\"intensity\":0.917,\"narrativeRole\":\"deterministic visual influence only\",\"spectrum\":[\"mineral-cyan\",\"weathered-stone\",\"deep-black\"]} eyes"},"head":{"form":"architectonic-cranial-crown"},"horns":{"form":"swept-architectural-blades"},"markings":{"form":"controlled resonance-influenced structural markings"},"mechanicalAugmentation":{"form":"ancient-proto-technology"},"scales":{"form":"precision-dark-alloy"},"tail":{"form":"anatomically balanced counterweight tail"},"wings":{"form":"segmented-forged-membrane"}},"environment":{"architecture":{"form":"gothic-megalithic-obsidian-foundation-chasm"},"atmosphere":"dark monumental primordial pressure","biome":"obsidian-foundation-chasm","depthLayers":{"background":["structured-energy-atmosphere"],"foreground":["precision-dark-alloy terrain mass"],"midground":["architectonic-basalt-citadel"]},"terrain":"precision-dark-alloy megalithic terrain","weather":"mineral fog, ash and controlled primordial storm"},"framing":{"aspectRatio":"1:1","cropPolicy":"FULL_BODY_REQUIRED","safeMargin":0.08,"subjectOccupancy":0.72},"identity":{"canonicalName":"Vyrnathos the Origin Seal","dna":{"archetype":"primordial-colossal-dragon","augmentation":"ancient-proto-technology","bodyStructure":"ancient-predatory","dnaVersion":"OX-GENESIS-DNA-1","environment":"obsidian-foundation-chasm","hornArchitecture":"swept-architectural-blades","lightingProfile":"eclipse-backlight","lineage":{"cohort":"GENESIS","era":"PRIMORDIAL ORIGIN","index":10,"maximumSupply":1000,"tier":"LEGENDARY"},"poseProfile":"wings-raised-foundation-pose","primaryMaterial":"basalt","secondaryMaterial":"weathered-stone","wingGeometry":"segmented-forged-membrane"},"dnaHash":"sha256:eae4083d2c95aef416944807cd3248d25531398181d338a5c4c57cea264c6dbd","era":"Ascended Origin","generationTheme":"Genesis / Primordial Origin","serial":"#0010","tier":"LEGENDARY","tokenId":10},"lighting":{"contrast":0.9,"exposureBias":-0.35,"fill":"restrained environmental fill","key":"eclipse-backlight","rim":"mineral-cyan","volumetrics":"structured-energy-atmosphere"},"materials":{"assignments":{"dragonPrimary":"basalt","dragonSecondary":"weathered-stone","energyAccent":"mineral-cyan","environmentPrimary":"weathered-basalt"},"libraryRefs":["basalt","ceramic-metal-composite","dark-forged-metal","obsidian","precision-dark-alloy","structured-energy-surface","weathered-stone"],"weatheringPolicy":"extreme physically coherent erosion, fractures, ash deposits and mineral variation"},"negativeConstraints":{"allowCartoonStyling":false,"allowDetailToMaskBadAnatomy":false,"allowFranchiseImitation":false,"allowUncontrolledText":false,"allowWatermark":false,"forbiddenElements":["broken wings","cartoon","duplicate limbs","excessive neon","franchise-derived design","generic fantasy dragon","malformed anatomy","random text","uncontrolled cyberpunk","watermark"]},"pose":{"contactPoints":["hind limbs grounded","forelimb contact controlled"],"headDirection":"toward primary focal axis","motionState":"controlled latent motion","stance":"wings-raised-foundation-pose","tailFlow":"counterbalancing structural arc","wingState":"precision-ribbed-wing"},"qualityRequirements":{"canonicalApprovalMode":"MANUAL_REQUIRED","maximumArtifactScore":0.0,"minimumScores":{"anatomy":0.9,"composition":0.82,"detail":0.8,"identityConsistency":0.95,"material":0.8,"silhouette":0.85,"traitCompliance":0.95,"visualGrammar":0.9},"requireManualApproval":true},"renderIntent":{"cinematicWeight":0.95,"detailDensity":0.9,"preserveIdentity":true,"realism":0.92,"styleIntent":"monumental dark primordial dragon realism","targetAspectRatio":"1:1","targetResolution":{"height":512,"width":512}},"resonance":{"accentGeometry":"swept-architectural-blades","atmosphericBehavior":"mineral fog shaped by deterministic glyph geometry","energyTopology":"chthonic-deterministic-topology","glyphInfluence":"7-spoke rhythm; 3-ring structural cadence","lightingRhythm":"eclipse-backlight","narrativeOnly":true,"spectrum":["mineral-cyan","weathered-stone","deep-black"],"strength":0.917},"seed":3674790545803592422,"specVersion":"OX-ART-SPEC-1"}